<?xml version="1.0" encoding="UTF-8"?>
<!-- Copyright (c) 2009 Mercury Federal Systems.

This file is part of OpenCPI.

OpenCPI is free software: you can redistribute it and/or modify
it under the terms of the GNU Lesser General Public License as published by
the Free Software Foundation, either version 3 of the License, or
(at your option) any later version.

OpenCPI is distributed in the hope that it will be useful,
but WITHOUT ANY WARRANTY; without even the implied warranty of
MERCHANTABILITY or FITNESS FOR A PARTICULAR PURPOSE.  See the
GNU Lesser General Public License for more details.

You should have received a copy of the GNU Lesser General Public License
along with OpenCPI.  If not, see <http://www.gnu.org/licenses/>.
-->

<!ELEMENT softpkg
      ( title?
	, author+
	, description?
	, propertyfile?
	, descriptor?
	, implementation+
	, usesdevice*
	)>
<!ATTLIST softpkg
	id		ID	#REQUIRED
	name	CDATA	#REQUIRED
	type	(sca_compliant | sca_non_compliant)  "sca_compliant"
	version	CDATA	#IMPLIED >

<!ELEMENT propertyfile
	(localfile
	)>
<!ATTLIST propertyfile
	type	CDATA	#IMPLIED>

<!ELEMENT localfile EMPTY>
<!ATTLIST localfile
	name	CDATA	#REQUIRED>

<!ELEMENT title (#PCDATA)>

<!ELEMENT author 
	( name*
	, company?
	, webpage?
	)>

<!ELEMENT name (#PCDATA)>

<!ELEMENT company (#PCDATA)>

<!ELEMENT webpage (#PCDATA)>

<!ELEMENT descriptor
	(localfile
	)>
<!ATTLIST descriptor
	name	CDATA	#IMPLIED>

<!ELEMENT implementation
	( description?
	, propertyfile?
	, code
	, compiler?
	, programminglanguage?
	, humanlanguage?
	, runtime?
	, ( os | processor | dependency )+
	, usesdevice*
	)>
<!ATTLIST implementation
	id		ID	#REQUIRED
	aepcompliance (aep_compliant | aep_non_compliant) "aep_compliant">

<!ELEMENT description (#PCDATA)>

<!ELEMENT code 
	( localfile
	, entrypoint?
	, stacksize?
	, priority?
	)>
<!ATTLIST code
	type	CDATA	#IMPLIED>

<!ELEMENT entrypoint (#PCDATA)>

<!ELEMENT stacksize (#PCDATA)>

<!ELEMENT priority (#PCDATA)>

<!ELEMENT compiler EMPTY>
<!ATTLIST compiler
	name		CDATA	#REQUIRED
	version 	CDATA	#IMPLIED>

<!ELEMENT programminglanguage EMPTY>
<!ATTLIST programminglanguage
	name		CDATA	#REQUIRED
	version		CDATA	#IMPLIED>

<!ELEMENT humanlanguage EMPTY>
<!ATTLIST humanlanguage
	name		CDATA	#REQUIRED>

<!ELEMENT os EMPTY>
<!ATTLIST os
	name		CDATA	#REQUIRED
	version		CDATA	#IMPLIED>

<!ELEMENT processor EMPTY>
<!ATTLIST processor
	name		CDATA	#REQUIRED>

<!ELEMENT dependency
	( softpkgref
	| propertyref
         )>
<!ATTLIST dependency
	type		CDATA	#REQUIRED>

<!ELEMENT softpkgref
         ( localfile
         , implref?
         )>

<!ELEMENT implref EMPTY>
<!ATTLIST implref 
	refid		CDATA	#REQUIRED>

<!ELEMENT propertyref EMPTY>
<!ATTLIST propertyref
	refid		CDATA	#REQUIRED
	value		CDATA	#REQUIRED>

<!ELEMENT runtime EMPTY>
<!ATTLIST runtime
	name		CDATA	#REQUIRED
	version		CDATA	#IMPLIED>

<!ELEMENT  usesdevice
	( propertyref+
	)>
<!ATTLIST usesdevice
	id			ID		#REQUIRED
	type		CDATA	#REQUIRED>



