<?xml version="1.0" encoding="us-ascii"?>
<!-- Copyright (c) 2009 Mercury Federal Systems.

This file is part of OpenCPI.

OpenCPI is free software: you can redistribute it and/or modify
it under the terms of the GNU Lesser General Public License as published by
the Free Software Foundation, either version 3 of the License, or
(at your option) any later version.

OpenCPI is distributed in the hope that it will be useful,
but WITHOUT ANY WARRANTY; without even the implied warranty of
MERCHANTABILITY or FITNESS FOR A PARTICULAR PURPOSE.  See the
GNU Lesser General Public License for more details.

You should have received a copy of the GNU Lesser General Public License
along with OpenCPI.  If not, see <http://www.gnu.org/licenses/>.
-->

<!DOCTYPE softpkg SYSTEM "softpkg.dtd">
<!--
    Generated by Zeligsoft Component Enabler 2.4.6
    http://www.zeligsoft.com
-->
<softpkg id="DCE:d8d79e23-e0f6-43f7-ac14-60737cfa06dc" name="FileTee" type="sca_compliant" version="">
    <title />
    <author />
    <descriptor name="">
        <localfile name="FileTee.scd.xml" />
    </descriptor>
    <!--[Implementation FileTeeImplementation1]-->
    <implementation id="DCE:e1653438-607f-43bc-a1b6-87ff446665c2" aepcompliance="aep_compliant">
        <code type="SharedLibrary">
            <localfile name="FileTee.zip" />
            <entrypoint>FileTeeWorker</entrypoint>
        </code>
<!--
        <os name="Linux" />
        <processor name="x86" />
-->
        <dependency type="Property Reference Dependency">
            <propertyref refid="DCE:c4b738d8-fbe6-4893-81cd-1bb7a77bfb43" value="RCC" />
        </dependency>
    </implementation>
</softpkg>
