<?xml version="1.0" encoding="us-ascii"?>
<!-- Copyright (c) 2009 Mercury Federal Systems.

This file is part of OpenCPI.

OpenCPI is free software: you can redistribute it and/or modify
it under the terms of the GNU Lesser General Public License as published by
the Free Software Foundation, either version 3 of the License, or
(at your option) any later version.

OpenCPI is distributed in the hope that it will be useful,
but WITHOUT ANY WARRANTY; without even the implied warranty of
MERCHANTABILITY or FITNESS FOR A PARTICULAR PURPOSE.  See the
GNU Lesser General Public License for more details.

You should have received a copy of the GNU Lesser General Public License
along with OpenCPI.  If not, see <http://www.gnu.org/licenses/>.
-->

<!DOCTYPE softpkg SYSTEM "softpkg.dtd">
<!--
    Generated by Zeligsoft Component Enabler 2.4.6
    http://www.zeligsoft.com
-->
<softpkg id="DCE:1dd52fca-1d51-4cc1-b4bc-daf71173b65f" name="GenericAssemblyController" type="sca_compliant" version="">
    <title />
    <author />
    <descriptor name="">
        <localfile name="GenericAssemblyController.scd.xml" />
    </descriptor>
    <!--[Implementation FileCopyAssemblyControllerImplementation1]-->
    <implementation id="DCE:cba02e8b-5358-45e1-9056-5f051f778a7f" aepcompliance="aep_compliant">
        <code type="Executable">
            <localfile name="cpi-generic-assy-controller" />
        </code>
        <os name="Linux" />
<!--
        <processor name="x86" />
-->
    </implementation>
</softpkg>
